{
  "dataset_version": "1.0.0",
  "created_at": "2026-01-16T00:00:00Z",
  "description": "Format compliance training examples - teaching the model to strictly follow answer_json contract structure across edge cases",
  "samples": [
    {
      "sample_id": "format_edge_case_001",
      "category": "format_compliance",
      "persona": "educator",
      "user_query": "Hi",
      "retrieved_context": [],
      "expected_output": {
        "version": "kwanzaa.answer.v1",
        "persona": "educator",
        "model_mode": "base_adapter_rag",
        "answer": {
          "text": "Hello! I'm here to help you learn about Kwanzaa, African American history, and related topics. I provide answers grounded in primary sources and historical documents.\n\nWhat would you like to know about? I can help with:\n- The Seven Principles (Nguzo Saba) of Kwanzaa\n- Kwanzaa celebration practices and symbols\n- Historical context of the Civil Rights Movement\n- African American history and culture\n- Primary source research and analysis\n\nFeel free to ask specific questions, and I'll provide cited, source-based answers.",
          "confidence": 0.95,
          "tone": "conversational",
          "completeness": "complete"
        },
        "sources": [],
        "retrieval_summary": {
          "query": "greeting",
          "top_k": 0,
          "namespaces": ["kwanzaa_primary_sources"],
          "results": []
        },
        "unknowns": {
          "unsupported_claims": [],
          "missing_context": [],
          "clarifying_questions": [
            "What topic would you like to explore?",
            "Are you a student, teacher, or researcher?",
            "Is this for a class project or personal learning?"
          ]
        }
      },
      "metadata": {
        "difficulty": "easy",
        "principle_focus": ["Imani"],
        "quality_score": 0.90,
        "reviewer": "human_annotator_001",
        "notes": "Edge case: minimal input that doesn't warrant retrieval but still requires valid answer_json",
        "edge_case": true
      }
    },
    {
      "sample_id": "format_multiple_unknowns_002",
      "category": "format_compliance",
      "persona": "researcher",
      "user_query": "Compare the economic policies of Kwanzaa celebrations in three different countries and analyze the impact on diaspora identity formation from 1990-2020",
      "retrieved_context": [
        {
          "rank": 1,
          "score": 0.54,
          "chunk_id": "kwanzaa_global::chunk::1",
          "doc_id": "kwanzaa_global",
          "namespace": "kwanzaa_primary_sources",
          "content": "Kwanzaa has been celebrated by people of African descent in various countries, though it originated as an African-American cultural celebration.",
          "metadata": {
            "citation_label": "Karenga, M. (1988) — Kwanzaa Global Spread",
            "canonical_url": "https://officialkwanzaawebsite.org/global",
            "source_org": "Official Kwanzaa Website",
            "year": 1988,
            "content_type": "essay",
            "license": "CC BY-NC 4.0",
            "tags": ["kwanzaa", "global", "international"]
          }
        }
      ],
      "expected_output": {
        "version": "kwanzaa.answer.v1",
        "persona": "researcher",
        "model_mode": "base_adapter_rag",
        "toggles": {
          "require_citations": true,
          "primary_sources_only": true,
          "creative_mode": false
        },
        "answer": {
          "text": "I cannot provide the comparative analysis you've requested because my corpus lacks the necessary data across multiple dimensions:\n\nWhile I can confirm that Kwanzaa has spread to various countries with populations of African descent [1], I do not have:\n\n1. Economic policy data for Kwanzaa celebrations in specific countries\n2. Comparative datasets across three or more countries\n3. Longitudinal data covering the 1990-2020 period\n4. Research on diaspora identity formation metrics\n5. Studies correlating celebration practices with identity outcomes\n\nThe retrieved source [1] only provides general information about Kwanzaa's global spread, but it was published in 1988 (before your study period) and contains no economic policy analysis or comparative country data. The relevance score of 0.54 reflects this mismatch.\n\nFor this research, you would need:\n- Peer-reviewed studies in diaspora studies journals\n- Comparative ethnographic research across multiple countries\n- Economic anthropology literature\n- Survey data from diaspora communities in specific countries\n- Longitudinal identity studies (1990-2020)\n\nI recommend searching databases like JSTOR, ProQuest, and Google Scholar with terms like \"Kwanzaa diaspora comparative\" or \"African diaspora identity formation longitudinal.\"",
          "confidence": 0.90,
          "tone": "formal",
          "completeness": "insufficient_data"
        },
        "sources": [
          {
            "citation_label": "Karenga, M. (1988) — Kwanzaa Global Spread",
            "canonical_url": "https://officialkwanzaawebsite.org/global",
            "source_org": "Official Kwanzaa Website",
            "year": 1988,
            "content_type": "essay",
            "license": "CC BY-NC 4.0",
            "namespace": "kwanzaa_primary_sources",
            "doc_id": "kwanzaa_global",
            "chunk_id": "kwanzaa_global::chunk::1",
            "tags": ["kwanzaa", "global", "international"],
            "relevance_score": 0.54
          }
        ],
        "retrieval_summary": {
          "query": "Kwanzaa economic policies countries comparison diaspora identity 1990-2020",
          "top_k": 10,
          "namespaces": ["kwanzaa_primary_sources"],
          "filters": {
            "year_gte": 1990,
            "year_lte": 2020
          },
          "results": [
            {
              "rank": 1,
              "score": 0.54,
              "snippet": "Kwanzaa has been celebrated by people of African descent...",
              "citation_label": "Karenga, M. (1988) — Kwanzaa Global Spread",
              "canonical_url": "https://officialkwanzaawebsite.org/global",
              "doc_id": "kwanzaa_global",
              "chunk_id": "kwanzaa_global::chunk::1",
              "namespace": "kwanzaa_primary_sources"
            }
          ],
          "execution_time_ms": 234
        },
        "unknowns": {
          "unsupported_claims": [],
          "missing_context": [
            "Country-specific economic policy data for Kwanzaa celebrations",
            "Comparative datasets across three or more countries",
            "Longitudinal identity formation research (1990-2020)",
            "Economic anthropology studies of diaspora cultural practices",
            "Quantitative celebration prevalence data by country",
            "Peer-reviewed research correlating celebration with identity metrics"
          ],
          "clarifying_questions": [
            "Which three countries are you specifically interested in comparing?",
            "Are you conducting primary research and need methodological guidance?",
            "Would information about Kwanzaa's core principles (like Ujamaa - Cooperative Economics) help frame your research?",
            "Do you have access to specific academic databases where this research might exist?"
          ],
          "out_of_scope": [
            "Contemporary economic policy analysis",
            "Cross-national comparative research",
            "Identity formation metrics and longitudinal studies",
            "Post-1988 global Kwanzaa practice research"
          ]
        },
        "integrity": {
          "citation_required": true,
          "citations_provided": true,
          "retrieval_confidence": "low",
          "fallback_behavior": "refusal"
        }
      },
      "metadata": {
        "difficulty": "hard",
        "principle_focus": ["Imani"],
        "quality_score": 0.94,
        "reviewer": "human_annotator_001",
        "notes": "Complex edge case with multiple unknowns categories populated - demonstrates handling of highly ambitious queries",
        "edge_case": true,
        "failure_mode": "Overly complex queries requiring multiple missing data types"
      }
    },
    {
      "sample_id": "format_partial_completeness_003",
      "category": "format_compliance",
      "persona": "creator",
      "user_query": "Create a lesson plan about Ujamaa for elementary students, including activities and discussion questions",
      "retrieved_context": [
        {
          "rank": 1,
          "score": 0.86,
          "chunk_id": "ujamaa_definition::chunk::1",
          "doc_id": "ujamaa_definition",
          "namespace": "kwanzaa_primary_sources",
          "content": "Ujamaa (Cooperative Economics): To build and maintain our own stores, shops, and other businesses and to profit from them together. This principle emphasizes economic cooperation and collective ownership within the community.",
          "metadata": {
            "citation_label": "Karenga, M. (1977) — Nguzo Saba: Ujamaa",
            "canonical_url": "https://officialkwanzaawebsite.org/ujamaa",
            "source_org": "Official Kwanzaa Website",
            "year": 1977,
            "content_type": "reference",
            "license": "CC BY-NC 4.0",
            "tags": ["ujamaa", "cooperative_economics", "nguzo_saba"]
          }
        }
      ],
      "expected_output": {
        "version": "kwanzaa.answer.v1",
        "persona": "creator",
        "model_mode": "base_adapter_rag",
        "toggles": {
          "require_citations": false,
          "primary_sources_only": false,
          "creative_mode": true
        },
        "answer": {